{
  "generated": {
    "by": "heretek-rigs scripts/generate-rigs.py",
    "notice": "Generated file. Do not edit by hand; regenerate it.",
    "rule": "openrig.status-rule/v1",
    "generatorVersion": 1
  },
  "listings": {
    "executive-and-architecture": {
      "state": "ok",
      "configurations": {
        "delivery.git-drift-coord=pi,delivery.tech-docs-lead=pi,delivery.tpm-scrum-lead=pi,exec.exec-director=pi,exec.product-director=pi,exec.system-architect=pi": {
          "platforms": {
            "linux-x64": {
              "label": "tested",
              "assistanceCount": 0,
              "date": "2026-10-18",
              "openrigVersion": "0.6.13",
              "recordIds": [
                "rr-20261018-executive-and-architecture"
              ],
              "packageDigests": [
                {
                  "algorithm": "sha256",
                  "value": "3400cb10eb61040d0ec467b4f12a5797efc931100c9630f899d599aa13aaad11",
                  "coverage": "openrig.package-digest/v1"
                }
              ]
            }
          },
          "communityReports": 0
        }
      }
    },
    "fullstack-and-web-studio": {
      "state": "ok",
      "configurations": {
        "build.go-backend-eng=pi,build.java-kotlin-eng=pi,build.python-backend-spec=pi,build.ts-node-fullstack=pi,design.a11y-specialist=pi,design.brand-copy-spec=pi,design.design-system-eng=pi,design.fe-perf-eng=pi,design.mobile-web-eng=pi,design.ui-ux-designer=pi,design.ux-research-analyst=pi": {
          "platforms": {
            "linux-x64": {
              "label": "tested",
              "assistanceCount": 0,
              "date": "2026-10-18",
              "openrigVersion": "0.6.13",
              "recordIds": [
                "rr-20261018-fullstack-and-web-studio"
              ],
              "packageDigests": [
                {
                  "algorithm": "sha256",
                  "value": "baf5daf1b37ce91508a9841d80511264e1b4a53777033263357fbe23f26fc9ef",
                  "coverage": "openrig.package-digest/v1"
                }
              ]
            }
          },
          "communityReports": 0
        }
      }
    },
    "systems-and-mobile-foundry": {
      "state": "ok",
      "configurations": {
        "mobile.android-mobile-spec=pi,mobile.ios-mobile-spec=pi,systems.cpp-lowlevel-eng=pi,systems.rust-systems-spec=pi": {
          "platforms": {
            "linux-x64": {
              "label": "tested",
              "assistanceCount": 0,
              "date": "2026-10-18",
              "openrigVersion": "0.6.13",
              "recordIds": [
                "rr-20261018-systems-and-mobile-foundry"
              ],
              "packageDigests": [
                {
                  "algorithm": "sha256",
                  "value": "f02680341f5667a302c12dcc59b081af226c58034f19c818d67556186630ba86",
                  "coverage": "openrig.package-digest/v1"
                }
              ]
            }
          },
          "communityReports": 0
        }
      }
    },
    "game-dev-and-sim-rig": {
      "state": "ok",
      "configurations": {
        "engine.engine-systems-eng=pi,engine.graphics-shader-eng=pi,engine.physics-sim-eng=pi,gameplay.game-ai-dev=pi,gameplay.game-systems-dev=pi,gameplay.tech-artist-pipeline=pi": {
          "platforms": {
            "linux-x64": {
              "label": "tested",
              "assistanceCount": 0,
              "date": "2026-10-18",
              "openrigVersion": "0.6.13",
              "recordIds": [
                "rr-20261018-game-dev-and-sim-rig"
              ],
              "packageDigests": [
                {
                  "algorithm": "sha256",
                  "value": "93951577a034ef0febf1aa59e9bc53c7b139b4988c05b1416a4ceea03b10729f",
                  "coverage": "openrig.package-digest/v1"
                }
              ]
            }
          },
          "communityReports": 0
        }
      }
    },
    "cloud-sre-and-data-platform": {
      "state": "ok",
      "configurations": {
        "data.analytics-metrics-eng=pi,data.cache-streaming-eng=pi,data.data-pipeline-eng=pi,data.dba-specialist=pi,ml.mlops-serving-eng=pi,ml.vector-rag-spec=pi,platform.cloud-platform-eng=pi,platform.dependency-patcher=pi,platform.k8s-orchestrator=pi,sre.observability-eng=pi,sre.sre-incident-eng=pi": {
          "platforms": {
            "linux-x64": {
              "label": "tested",
              "assistanceCount": 0,
              "date": "2026-10-18",
              "openrigVersion": "0.6.13",
              "recordIds": [
                "rr-20261018-cloud-sre-and-data-platform"
              ],
              "packageDigests": [
                {
                  "algorithm": "sha256",
                  "value": "644abf20b17a7a4180099b6b34ac89eef66d2f00b405217e49068aa08c041d28",
                  "coverage": "openrig.package-digest/v1"
                }
              ]
            }
          },
          "communityReports": 0
        }
      }
    },
    "qa-and-verification-gauntlet": {
      "state": "ok",
      "configurations": {
        "qa.api-contract-tester=pi,qa.e2e-browser-qa=pi,qa.load-stress-tester=pi,qa.release-qa-officer=pi,qa.sabotage-qa-tester=pi,qa.static-analysis-lead=pi": {
          "platforms": {
            "linux-x64": {
              "label": "tested",
              "assistanceCount": 0,
              "date": "2026-10-18",
              "openrigVersion": "0.6.13",
              "recordIds": [
                "rr-20261018-qa-and-verification-gauntlet"
              ],
              "packageDigests": [
                {
                  "algorithm": "sha256",
                  "value": "bcb250a1a2634738428bebe21a81b8c37366f1f9aa033e2c936f0302f5e25365",
                  "coverage": "openrig.package-digest/v1"
                }
              ]
            }
          },
          "communityReports": 0
        }
      }
    },
    "defensive-sec-and-red-team": {
      "state": "ok",
      "configurations": {
        "blue.appsec-engineer=pi,blue.cloud-sec-auditor=pi,blue.compliance-auditor=pi,blue.threat-modeler=pi,red.ai-red-teamer=pi,red.binary-reverse-eng=pi,red.firmware-sec-analyst=pi": {
          "platforms": {
            "linux-x64": {
              "label": "tested",
              "assistanceCount": 0,
              "date": "2026-10-18",
              "openrigVersion": "0.6.13",
              "recordIds": [
                "rr-20261018-defensive-sec-and-red-team"
              ],
              "packageDigests": [
                {
                  "algorithm": "sha256",
                  "value": "8ba4418ba46e94c611c68d4aac04fcc7c59d4a5a5f5960ca9e4b6f7026f94fac",
                  "coverage": "openrig.package-digest/v1"
                }
              ]
            }
          },
          "communityReports": 0
        }
      }
    },
    "heretek-omni-fleet": {
      "state": "ok",
      "configurations": {
        "command.exec-director=pi,command.system-architect=pi,command.tpm-scrum-lead=pi": {
          "platforms": {
            "linux-x64": {
              "label": "tested",
              "assistanceCount": 0,
              "date": "2026-10-18",
              "openrigVersion": "0.6.13",
              "recordIds": [
                "rr-20261018-heretek-omni-fleet"
              ],
              "packageDigests": [
                {
                  "algorithm": "sha256",
                  "value": "d1f0c86a2eab17b484f9f552e22fef6f5e4b5e9b03caef7810b8e41187a9a3ba",
                  "coverage": "openrig.package-digest/v1"
                }
              ]
            }
          },
          "communityReports": 0
        }
      }
    }
  },
  "harnessChecks": {
    "state": "ok",
    "harnesses": {
      "pi": {
        "linux-x64": {
          "result": "PASS",
          "date": "2026-10-18",
          "openrigVersion": "0.6.13",
          "harnessVersion": "1.3.0",
          "recordIds": [
            "rr-20261018-pi-harness"
          ]
        }
      }
    }
  },
  "bodyDigest": "dff96850ea660fac0cb52dcdfafd30e5f3831b311d54d055fe57666c6b14dab4"
}
